ticker,company_name,exchange,gics_sub_industry,gics_name,market_cap,addv_usd,mcap_tier,in_xbi,in_ibb,source,universe_date
ABBV,ABBVIE INC.,NYSE,35202010,Pharmaceuticals,368380313600.0,1470414883.4654236,large_cap,True,False,EDGAR,2026-04-27
AMGN,Amgen Inc. Common Stock,NASDAQ,35201010,Biotechnology,189471506432.0,909737931.322225,large_cap,True,True,EDGAR,2026-04-27
GILD,"Gilead Sciences, Inc. Common Stock",NASDAQ,35201010,Biotechnology,175400304640.0,787106466.9702657,large_cap,True,True,EDGAR,2026-04-27
VRTX,Vertex Pharmaceuticals Incorporated Common Stock,NASDAQ,35202010,Pharmaceuticals,114703859712.0,560112978.4512329,large_cap,True,True,EDGAR,2026-04-27
REGN,"Regeneron Pharmaceuticals, Inc. Common Stock",NASDAQ,35202010,Pharmaceuticals,78668226560.0,482475277.84403485,large_cap,True,True,EDGAR,2026-04-27
ARGX,argenx SE American Depositary Shares,NASDAQ,35201010,Biotechnology,42375901184.0,234887787.1459961,large_cap,False,True,EDGAR,2026-04-27
ALNY,"Alnylam Pharmaceuticals, Inc. Common Stock",NASDAQ,35202010,Pharmaceuticals,41749766144.0,356929226.2531535,large_cap,True,True,EDGAR,2026-04-27
ONC,BeOne Medicines Ltd. American Depositary Shares,NASDAQ,35202010,Pharmaceuticals,32613140480.0,63114576.493631996,large_cap,False,True,EDGAR,2026-04-27
INSM,Insmed Incorporated Common Stock,NASDAQ,35202010,Pharmaceuticals,30759256064.0,348048885.97895306,large_cap,True,True,EDGAR,2026-04-27
NTRA,"Natera, Inc. Common Stock",NASDAQ,35203010,Life Science Tools & Services,28033021952.0,250885106.22817993,large_cap,True,True,ETF,2026-04-27
BIIB,Biogen Inc. Common Stock,NASDAQ,35201010,Biotechnology,26755547136.0,221591515.08758545,large_cap,True,True,EDGAR,2026-04-27
UTHR,United Therapeutics Corporation Common Stock,NASDAQ,35202010,Pharmaceuticals,23244013568.0,329456508.96972656,large_cap,True,True,EDGAR,2026-04-27
BNTX,BioNTech SE American Depositary Share,NASDAQ,35201010,Biotechnology,22619281408.0,93304948.00114949,large_cap,False,True,EDGAR,2026-04-27
MRNA,"Moderna, Inc. Common Stock",NASDAQ,35201010,Biotechnology,20694827008.0,317162834.46964264,large_cap,True,True,EDGAR,2026-04-27
ROIV,Roivant Sciences Ltd. Common Shares,NASDAQ,35202010,Pharmaceuticals,19896489984.0,150253302.73949942,large_cap,True,True,EDGAR,2026-04-27
RVMD,"Revolution Medicines, Inc. Common Stock",NASDAQ,35201010,Biotechnology,19442792448.0,418722287.499644,large_cap,True,True,EDGAR,2026-04-27
ILMN,"Illumina, Inc. Common Stock",NASDAQ,35203010,Life Science Tools & Services,18799054848.0,176103410.0337728,large_cap,False,True,ETF,2026-04-27
INCY,Incyte Corp. Common Stock,NASDAQ,35201010,Biotechnology,18357094400.0,136534437.51764932,large_cap,True,True,ETF,2026-04-27
GMAB,Genmab A/S ADS,NASDAQ,35202010,Pharmaceuticals,15894354944.0,43878351.02916082,large_cap,False,True,EDGAR,2026-04-27
ASND,Ascendis Pharma A/S American Depositary Shares,NASDAQ,35202010,Pharmaceuticals,13961417728.0,133047010.29993694,large_cap,False,True,EDGAR,2026-04-27
BBIO,"BridgeBio Pharma, Inc. Common Stock",NASDAQ,35202010,Pharmaceuticals,13593664512.0,126780787.78470357,large_cap,True,True,EDGAR,2026-04-27
NBIX,"Neurocrine Biosciences, Inc. Common Stock",NASDAQ,35201010,Biotechnology,13118509056.0,141715909.59780374,large_cap,True,True,EDGAR,2026-04-27
MEDP,"Medpace Holdings, Inc. Common Stock",NASDAQ,35203010,Life Science Tools & Services,12907807744.0,186532248.180542,large_cap,False,True,ETF,2026-04-27
SMMT,Summit Therapeutics Inc. Common Stock,NASDAQ,35202010,Pharmaceuticals,12095813632.0,71431156.50104205,large_cap,True,True,EDGAR,2026-04-27
IONS,"Ionis Pharmaceuticals, Inc. Common Stock",NASDAQ,35202010,Pharmaceuticals,11839311872.0,141206803.78977457,large_cap,True,True,EDGAR,2026-04-27
EXEL,"Exelixis, Inc. Common Stock",NASDAQ,35201010,Biotechnology,11062306816.0,105386434.80116527,large_cap,True,True,EDGAR,2026-04-27
BMRN,BioMarin Pharmaceutical Inc. Common Stock,NASDAQ,35202010,Pharmaceuticals,10660484096.0,98258473.0922699,large_cap,True,True,EDGAR,2026-04-27
MDGL,"Madrigal Pharmaceuticals, Inc. Common Stock",NASDAQ,35202010,Pharmaceuticals,10139465728.0,174941641.38437906,large_cap,True,True,EDGAR,2026-04-27
ABVX,Abivax SA American Depositary Shares,NASDAQ,35202010,Pharmaceuticals,9804214272.0,116977080.36465962,mid_cap,False,True,EDGAR,2026-04-27
IBRX,"ImmunityBio, Inc. Common Stock",NASDAQ,35201010,Biotechnology,8800634880.0,164902938.18394342,mid_cap,True,True,EDGAR,2026-04-27
TEM,"Tempus AI, Inc. Class A Common Stock",NASDAQ,,,8704491520.0,257331648.25417838,mid_cap,False,True,ETF,2026-04-27
AXSM,"Axsome Therapeutics, Inc. Common Stock",NASDAQ,35202010,Pharmaceuticals,8075569152.0,101597765.10060628,mid_cap,False,True,EDGAR,2026-04-27
PRAX,"Praxis Precision Medicines, Inc. Common Stock",NASDAQ,35202010,Pharmaceuticals,8043041792.0,130713235.73730469,mid_cap,True,True,EDGAR,2026-04-27
TECH,Bio-Techne Corp Common Stock,NASDAQ,35201010,Biotechnology,7949392384.0,112213805.31907399,mid_cap,False,True,EDGAR,2026-04-27
ARWR,"Arrowhead Pharmaceuticals, Inc. Common Stock",NASDAQ,35202010,Pharmaceuticals,7941225472.0,137869231.17491403,mid_cap,True,True,EDGAR,2026-04-27
PCVX,"Vaxcyte, Inc. Common Stock",NASDAQ,35201010,Biotechnology,7881795584.0,73465731.66163127,mid_cap,True,True,EDGAR,2026-04-27
CRL,"Charles River Laboratories International, Inc.",NYSE,35203010,Life Science Tools & Services,7734179840.0,142762797.59994507,mid_cap,False,True,ETF,2026-04-27
NUVL,"Nuvalent, Inc. Class A Common Stock",NASDAQ,35202010,Pharmaceuticals,7659654144.0,64729889.06000773,mid_cap,True,True,EDGAR,2026-04-27
CYTK,"Cytokinetics, Incorporated Common Stock",NASDAQ,35202010,Pharmaceuticals,7659494912.0,114126239.42838033,mid_cap,True,True,EDGAR,2026-04-27
HALO,"Halozyme Therapeutics, Inc. Common Stock",NASDAQ,35201010,Biotechnology,7511782400.0,94332071.54866536,mid_cap,True,True,EDGAR,2026-04-27
KRYS,"Krystal Biotech, Inc. Common Stock",NASDAQ,35201010,Biotechnology,7332310016.0,72664896.4263916,mid_cap,True,True,EDGAR,2026-04-27
ACLX,"Arcellx, Inc. Common Stock",NASDAQ,35201010,Biotechnology,6696523264.0,126963839.38819885,mid_cap,True,True,EDGAR,2026-04-27
RGEN,Repligen Corporation Common Stock,NASDAQ,35201010,Biotechnology,6623975424.0,111275171.05957031,mid_cap,False,True,EDGAR,2026-04-27
GRFS,"Grifols, S.A. American Depositary Shares",NASDAQ,35202010,Pharmaceuticals,6463820288.0,6358720.620112419,mid_cap,False,True,EDGAR,2026-04-27
KYMR,"Kymera Therapeutics, Inc. Common Stock",NASDAQ,35201010,Biotechnology,6461178880.0,47948283.20022583,mid_cap,True,True,EDGAR,2026-04-27
PTGX,"Protagonist Therapeutics, Inc. Common Stock",NASDAQ,35202010,Pharmaceuticals,6195188224.0,88268449.7488149,mid_cap,True,True,EDGAR,2026-04-27
RYTM,"Rhythm Pharmaceuticals, Inc. Common Stock",NASDAQ,35202010,Pharmaceuticals,5862953472.0,79393748.4029897,mid_cap,True,True,EDGAR,2026-04-27
COGT,"Cogent Biosciences, Inc. Common Stock",NASDAQ,35202010,Pharmaceuticals,5578553856.0,84306649.89953358,mid_cap,True,True,EDGAR,2026-04-27
PTCT,"PTC Therapeutics, Inc. Common Stock",NASDAQ,35202010,Pharmaceuticals,5545906688.0,65195497.79240926,mid_cap,True,True,EDGAR,2026-04-27
MIRM,"Mirum Pharmaceuticals, Inc. Common Stock",NASDAQ,35202010,Pharmaceuticals,5530912768.0,78227545.75846355,mid_cap,True,True,EDGAR,2026-04-27
CGON,"CG Oncology, Inc. Common stock",NASDAQ,35201010,Biotechnology,5441848320.0,91102400.82043965,mid_cap,True,True,EDGAR,2026-04-27
XENE,Xenon Pharmaceuticals Inc. Common Shares,NASDAQ,35202010,Pharmaceuticals,5255173632.0,66071240.02192179,mid_cap,False,True,EDGAR,2026-04-27
CAI,"Caris Life Sciences, Inc. Common Stock",NASDAQ,35201010,Biotechnology,5219250688.0,44100405.15043259,mid_cap,False,True,ETF,2026-04-27
CELC,Celcuity Inc. Common Stock,NASDAQ,35201010,Biotechnology,5205979648.0,87271027.59641011,mid_cap,True,False,ETF,2026-04-27
TERN,"Terns Pharmaceuticals, Inc. Common Stock",NASDAQ,35202010,Pharmaceuticals,5196900352.0,499994248.4365209,mid_cap,False,True,EDGAR,2026-04-27
BRKR,Bruker Corporation Common Stock,NASDAQ,,,5180020736.0,75758671.38406117,mid_cap,False,True,ETF,2026-04-27
IMVT,"Immunovant, Inc. Common Stock",NASDAQ,35201010,Biotechnology,4803359232.0,39762722.13133494,mid_cap,True,True,EDGAR,2026-04-27
TGTX,"TG Therapeutics, Inc. Common Stock",NASDAQ,35202010,Pharmaceuticals,4797035520.0,69686801.15964253,mid_cap,True,False,EDGAR,2026-04-27
APGE,"Apogee Therapeutics, Inc. Common Stock",NASDAQ,35201010,Biotechnology,4596957696.0,82483703.6112976,mid_cap,True,True,EDGAR,2026-04-27
CRSP,CRISPR Therapeutics AG Common Shares,NASDAQ,35201010,Biotechnology,4577539584.0,87319418.00079346,mid_cap,True,True,EDGAR,2026-04-27
SRRK,Scholar Rock Holding Corporation Common Stock,NASDAQ,35201010,Biotechnology,4571198464.0,80046452.1036911,mid_cap,True,True,EDGAR,2026-04-27
ALKS,Alkermes plc Ordinary Shares,NASDAQ,35202010,Pharmaceuticals,4532878336.0,81522023.25066249,mid_cap,True,True,EDGAR,2026-04-27
FOLD,"Amicus Therapeutics, Inc. Common Stock",NASDAQ,35202010,Pharmaceuticals,4512189952.0,47191878.52702141,mid_cap,True,True,EDGAR,2026-04-27
ERAS,"Erasca, Inc. Common Stock",NASDAQ,35202010,Pharmaceuticals,4195793920.0,108411346.20705605,mid_cap,True,True,EDGAR,2026-04-27
CNTA,Centessa Pharmaceuticals plc American Depositary Shares,NASDAQ,35202010,Pharmaceuticals,4193834496.0,155230364.92444357,mid_cap,False,True,EDGAR,2026-04-27
STVN,Stevanato Group S.p.A.,NYSE,,,4157846016.0,8591968.874142965,mid_cap,False,True,ETF,2026-04-27
VKTX,"Viking Therapeutics, Inc. Common Stock",NASDAQ,35202010,Pharmaceuticals,3876846592.0,77442014.75749333,mid_cap,True,False,EDGAR,2026-04-27
CRNX,"Crinetics Pharmaceuticals, Inc. Common Stock",NASDAQ,35202010,Pharmaceuticals,3774627072.0,42228808.400154114,mid_cap,False,True,EDGAR,2026-04-27
GPCR,Structure Therapeutics Inc. American Depositary Shares,NASDAQ,35202010,Pharmaceuticals,3675981312.0,53384007.33078003,mid_cap,False,True,EDGAR,2026-04-27
ADMA,ADMA Biologics Inc Common Stock,NASDAQ,35201010,Biotechnology,3541426688.0,92055951.25198047,mid_cap,True,True,EDGAR,2026-04-27
ACAD,ACADIA Pharmaceuticals Inc. Common Stock,NASDAQ,35202010,Pharmaceuticals,3464450304.0,41947482.551670074,mid_cap,True,True,EDGAR,2026-04-27
DNTH,"Dianthus Therapeutics, Inc. Common Stock",NASDAQ,35202010,Pharmaceuticals,3408572672.0,79540120.95713298,mid_cap,True,False,EDGAR,2026-04-27
NAMS,NewAmsterdam Pharma Company N.V. Ordinary Shares,NASDAQ,35202010,Pharmaceuticals,3384876544.0,27778550.605125427,mid_cap,False,True,EDGAR,2026-04-27
SYRE,"Spyre Therapeutics, Inc. Common Stock",NASDAQ,35202010,Pharmaceuticals,3381939456.0,71907010.51263173,mid_cap,True,True,EDGAR,2026-04-27
LEGN,Legend Biotech Corporation American Depositary Shares,NASDAQ,35202010,Pharmaceuticals,3368042240.0,39765711.626262665,mid_cap,False,True,EDGAR,2026-04-27
EWTX,"Edgewise Therapeutics, Inc. Common Stock",NASDAQ,35202010,Pharmaceuticals,3184861696.0,25931949.29748535,mid_cap,False,True,EDGAR,2026-04-27
DNLI,Denali Therapeutics Inc. Common Stock,NASDAQ,35201010,Biotechnology,3181345280.0,34954329.3448321,mid_cap,True,True,EDGAR,2026-04-27
ALMS,Alumis Inc. Common Stock,NASDAQ,35202010,Pharmaceuticals,3169642752.0,38375220.46315511,mid_cap,False,True,EDGAR,2026-04-27
DYN,"Dyne Therapeutics, Inc. Common Stock",NASDAQ,35202010,Pharmaceuticals,3018346240.0,38619677.19825109,mid_cap,True,True,EDGAR,2026-04-27
IDYA,"IDEAYA Biosciences, Inc. Common Stock",NASDAQ,35202010,Pharmaceuticals,2925085184.0,49084277.224095665,mid_cap,True,True,EDGAR,2026-04-27
TARS,"Tarsus Pharmaceuticals, Inc. Common Stock",NASDAQ,35201010,Biotechnology,2904123136.0,33052494.535013836,mid_cap,False,True,EDGAR,2026-04-27
VRDN,"Viridian Therapeutics, Inc. Common Stock",NASDAQ,35202010,Pharmaceuticals,2834188032.0,52501970.260222755,mid_cap,True,False,EDGAR,2026-04-27
CPRX,"Catalyst Pharmaceuticals, Inc. Common Stock",NASDAQ,35202010,Pharmaceuticals,2803631360.0,32748487.622623444,mid_cap,True,False,EDGAR,2026-04-27
RCUS,"Arcus Biosciences, Inc.",NYSE,35202010,Pharmaceuticals,2784011776.0,29369310.68467458,mid_cap,True,True,EDGAR,2026-04-27
ARQT,"Arcutis Biotherapeutics, Inc. Common Stock",NASDAQ,35202010,Pharmaceuticals,2758502400.0,28441506.38408025,mid_cap,True,True,EDGAR,2026-04-27
VERA,"Vera Therapeutics, Inc. Class A Common Stock",NASDAQ,35202010,Pharmaceuticals,2734349056.0,51661690.69115957,mid_cap,True,True,EDGAR,2026-04-27
TWST,Twist Bioscience Corporation Common Stock,NASDAQ,35201010,Biotechnology,2725918208.0,64617711.3792038,mid_cap,True,True,EDGAR,2026-04-27
TNGX,"Tango Therapeutics, Inc.",NASDAQ,35202010,Pharmaceuticals,2665427712.0,67961542.63977687,mid_cap,True,True,EDGAR,2026-04-27
VCYT,"Veracyte, Inc. Common Stock",NASDAQ,35203010,Life Science Tools & Services,2644376320.0,28982999.84433492,mid_cap,True,True,ETF,2026-04-27
BEAM,Beam Therapeutics Inc. Common Stock,NASDAQ,35201010,Biotechnology,2579000064.0,56759058.68739446,mid_cap,True,True,EDGAR,2026-04-27
TVTX,"Travere Therapeutics, Inc. Common Stock",NASDAQ,35202010,Pharmaceuticals,2486832128.0,78897178.85089874,mid_cap,True,True,EDGAR,2026-04-27
IMNM,"Immunome, Inc. Common Stock",NASDAQ,35202010,Pharmaceuticals,2332806656.0,27986218.05842082,mid_cap,True,False,EDGAR,2026-04-27
MAZE,"Maze Therapeutics, Inc. Common Stock",NASDAQ,35201010,Biotechnology,2332349440.0,40810045.79445521,mid_cap,False,True,EDGAR,2026-04-27
BCRX,"BioCryst Pharmaceuticals, Inc. Common Stock",NASDAQ,35201010,Biotechnology,2297333760.0,56396501.25677427,mid_cap,True,True,EDGAR,2026-04-27
APLS,"Apellis Pharmaceuticals, Inc. Common Stock",NASDAQ,35202010,Pharmaceuticals,2286876928.0,287502632.0043437,mid_cap,True,True,EDGAR,2026-04-27
IRON,"Disc Medicine, Inc. Common Stock",NASDAQ,35202010,Pharmaceuticals,2256595200.0,29654377.55549113,mid_cap,True,True,EDGAR,2026-04-27
WVE,Wave Life Sciences Ltd. Ordinary Shares,NASDAQ,35202010,Pharmaceuticals,2240233984.0,43869574.46478049,mid_cap,False,True,EDGAR,2026-04-27
TXG,"10x Genomics, Inc. Class A Common Stock",NASDAQ,,,2216501760.0,52885265.58153788,mid_cap,False,True,ETF,2026-04-27
GLPG,Galapagos NV American Depositary Shares,NASDAQ,35202010,Pharmaceuticals,2119908736.0,5232305.019569397,mid_cap,False,True,EDGAR,2026-04-27
SNDX,"Syndax Pharmaceuticals, Inc. Common Stock",NASDAQ,35202010,Pharmaceuticals,2085943936.0,35491685.15054067,mid_cap,True,True,EDGAR,2026-04-27
ZLAB,Zai Lab Limited American Depositary Shares,NASDAQ,35202010,Pharmaceuticals,2083364992.0,17562081.392059326,mid_cap,False,True,EDGAR,2026-04-27
TYRA,"Tyra Biosciences, Inc. Common Stock",NASDAQ,35202010,Pharmaceuticals,2049643776.0,40534932.90168762,mid_cap,True,True,EDGAR,2026-04-27
ADPT,Adaptive Biotechnologies Corporation Common Stock,NASDAQ,35201010,Biotechnology,2044875136.0,26457037.18798955,mid_cap,False,True,EDGAR,2026-04-27
ORKA,"Oruka Therapeutics, Inc. Common Stock",NASDAQ,35202010,Pharmaceuticals,2021341824.0,65643606.856791176,mid_cap,True,True,EDGAR,2026-04-27
GRAL,"GRAIL, Inc. Common Stock",NASDAQ,35203010,Life Science Tools & Services,1985790592.0,40526931.84739431,small_cap,True,True,ETF,2026-04-27
RARE,Ultragenyx Pharmaceutical Inc. Common Stock,NASDAQ,35202010,Pharmaceuticals,1977045504.0,43263545.10122935,small_cap,True,True,EDGAR,2026-04-27
MLYS,"Mineralys Therapeutics, Inc. Common Stock",NASDAQ,35202010,Pharmaceuticals,1969347584.0,34403744.66661453,small_cap,True,True,EDGAR,2026-04-27
MESO,Mesoblast Limited American Depositary Shares,NASDAQ,35201010,Biotechnology,1941208576.0,4009111.838363012,small_cap,False,True,EDGAR,2026-04-27
CLDX,"Celldex Therapeutics, Inc.",NASDAQ,35203010,Life Science Tools & Services,1899803520.0,37013409.834423065,small_cap,True,False,EDGAR,2026-04-27
AUPH,Aurinia Pharmaceuticals Inc Ordinary Shares,NASDAQ,35202010,Pharmaceuticals,1872231296.0,17226925.14750163,small_cap,False,True,EDGAR,2026-04-27
ANAB,"AnaptysBio, Inc. Common Stock",NASDAQ,35202010,Pharmaceuticals,1860587136.0,41906704.211800896,small_cap,True,True,EDGAR,2026-04-27
SRPT,"Sarepta Therapeutics, Inc. Common Stock (DE)",NASDAQ,35202010,Pharmaceuticals,1801624576.0,66895080.64249039,small_cap,True,True,EDGAR,2026-04-27
RLAY,"Relay Therapeutics, Inc. Common Stock",NASDAQ,35201010,Biotechnology,1774747264.0,39203746.283810936,small_cap,True,True,EDGAR,2026-04-27
CAPR,"Capricor Therapeutics, Inc. Common Stock",NASDAQ,35202010,Pharmaceuticals,1772761088.0,38759942.12142944,small_cap,True,False,EDGAR,2026-04-27
STOK,"Stoke Therapeutics, Inc. Common Stock",NASDAQ,35202010,Pharmaceuticals,1771774080.0,26899354.21628316,small_cap,True,True,EDGAR,2026-04-27
SLNO,"Soleno Therapeutics, Inc. Common Stock",NASDAQ,35202010,Pharmaceuticals,1761688704.0,263500695.3885778,small_cap,True,False,EDGAR,2026-04-27
DFTX,"Definium Therapeutics, Inc. Common Shares",NASDAQ,35202010,Pharmaceuticals,1758674944.0,40817527.711626686,small_cap,False,True,EDGAR,2026-04-27
RXRX,"Recursion Pharmaceuticals, Inc. Class A Common Stock",NASDAQ,35201010,Biotechnology,1753631616.0,41255730.22228082,small_cap,True,True,EDGAR,2026-04-27
ZYME,Zymeworks Inc. Common Stock,NASDAQ,35202010,Pharmaceuticals,1742400512.0,15232354.210802713,small_cap,False,True,EDGAR,2026-04-27
PHVS,Pharvaris N.V. Ordinary Shares,NASDAQ,35202010,Pharmaceuticals,1699988992.0,5460604.14000829,small_cap,False,True,EDGAR,2026-04-27
AGIO,"Agios Pharmaceuticals, Inc. Common Stock",NASDAQ,35202010,Pharmaceuticals,1648197760.0,36488311.48811976,small_cap,True,True,EDGAR,2026-04-27
VCEL,Vericel Corporation Common Stock,NASDAQ,35201010,Biotechnology,1639655168.0,22698303.524773914,small_cap,True,True,EDGAR,2026-04-27
NVAX,"Novavax, Inc. Common Stock",NASDAQ,35201010,Biotechnology,1630988928.0,31155967.795238495,small_cap,True,True,EDGAR,2026-04-27
ELVN,"Enliven Therapeutics, Inc. Common Stock",NASDAQ,35202010,Pharmaceuticals,1629561088.0,58154772.30925242,small_cap,False,True,EDGAR,2026-04-27
PVLA,"Palvella Therapeutics, Inc. Common Stock",NASDAQ,35202010,Pharmaceuticals,1625442176.0,32279468.178431194,small_cap,True,False,EDGAR,2026-04-27
NTLA,"Intellia Therapeutics, Inc. Common Stock",NASDAQ,35203010,Life Science Tools & Services,1560544128.0,47467355.53632418,small_cap,True,True,EDGAR,2026-04-27
IOVA,"Iovance Biotherapeutics, Inc. Common Stock",NASDAQ,35201010,Biotechnology,1553095168.0,51390778.070524536,small_cap,True,True,EDGAR,2026-04-27
SION,"Sionna Therapeutics, Inc. Common Stock",NASDAQ,35202010,Pharmaceuticals,1547933696.0,16410721.537679037,small_cap,True,True,EDGAR,2026-04-27
NRIX,"Nurix Therapeutics, Inc. Common stock",NASDAQ,35202010,Pharmaceuticals,1547787264.0,20249030.70619583,small_cap,True,True,EDGAR,2026-04-27
AMLX,"Amylyx Pharmaceuticals, Inc. Common Stock",NASDAQ,35202010,Pharmaceuticals,1524304512.0,16958827.833185196,small_cap,False,True,EDGAR,2026-04-27
IMCR,Immunocore Holdings plc American Depositary Shares,NASDAQ,35201010,Biotechnology,1522880256.0,12893632.124010721,small_cap,False,True,EDGAR,2026-04-27
VIR,"Vir Biotechnology, Inc. Common Stock",NASDAQ,35201010,Biotechnology,1489442176.0,19467134.6678257,small_cap,True,True,EDGAR,2026-04-27
NUVB,Nuvation Bio Inc.,NYSE,35202010,Pharmaceuticals,1487716480.0,14775370.963756243,small_cap,False,True,EDGAR,2026-04-27
NVCR,NovoCure Limited Ordinary Shares,NASDAQ,,,1372360448.0,13465001.805416742,small_cap,False,True,ETF,2026-04-27
TRVI,"Trevi Therapeutics, Inc. Common Stock",NASDAQ,35202010,Pharmaceuticals,1370780160.0,20965770.801614124,small_cap,False,True,EDGAR,2026-04-27
BHVN,Biohaven Ltd.,NYSE,35202010,Pharmaceuticals,1367291392.0,20169585.933472317,small_cap,True,True,EDGAR,2026-04-27
MBX,"MBX Biosciences, Inc. Common Stock",NASDAQ,35202010,Pharmaceuticals,1363544064.0,14327874.863433838,small_cap,False,True,EDGAR,2026-04-27
ARDX,"Ardelyx, Inc. Common Stock",NASDAQ,35202010,Pharmaceuticals,1361123200.0,18960546.172083218,small_cap,True,False,EDGAR,2026-04-27
KOD,Kodiak Sciences Inc Common Stock,NASDAQ,35201010,Biotechnology,1347949312.0,59157431.30912145,small_cap,True,True,EDGAR,2026-04-27
ATAI,AtaiBeckley Inc. Common Stock,NASDAQ,35202010,Pharmaceuticals,1293043968.0,27843432.13343541,small_cap,False,True,EDGAR,2026-04-27
DMRA,"Damora Therapeutics, Inc. Common Stock",NASDAQ,35202010,Pharmaceuticals,1274077440.0,6743682.641652425,small_cap,True,False,EDGAR,2026-04-27
RAPP,"Rapport Therapeutics, Inc. Common Stock",NASDAQ,35202010,Pharmaceuticals,1262066816.0,11348906.89593633,small_cap,False,True,EDGAR,2026-04-27
ZBIO,"Zenas BioPharma, Inc. Common Stock",NASDAQ,35202010,Pharmaceuticals,1236231296.0,17903797.41733551,small_cap,True,True,EDGAR,2026-04-27
TSHA,"Taysha Gene Therapies, Inc. Common Stock",NASDAQ,35201010,Biotechnology,1218941056.0,15972550.322182974,small_cap,True,True,EDGAR,2026-04-27
ORIC,"Oric Pharmaceuticals, Inc. Common Stock",NASDAQ,35202010,Pharmaceuticals,1216400128.0,21845214.933993023,small_cap,True,True,EDGAR,2026-04-27
GLUE,"Monte Rosa Therapeutics, Inc. Common Stock",NASDAQ,35201010,Biotechnology,1201585920.0,20453325.879370373,small_cap,True,True,EDGAR,2026-04-27
BCAX,Bicara Therapeutics Inc. Common Stock,NASDAQ,35202010,Pharmaceuticals,1192926208.0,11920985.931771597,small_cap,True,True,EDGAR,2026-04-27
ALVO,Alvotech Ordinary Shares,NASDAQ,35201010,Biotechnology,1184084352.0,1788439.1973948479,small_cap,False,True,EDGAR,2026-04-27
CRVS,"Corvus Pharmaceuticals, Inc. Common Stock",NASDAQ,35202010,Pharmaceuticals,1182613120.0,20381128.43313535,small_cap,True,True,EDGAR,2026-04-27
OLMA,"Olema Pharmaceuticals, Inc. Common Stock",NASDAQ,35202010,Pharmaceuticals,1167529216.0,19808151.797914505,small_cap,True,True,EDGAR,2026-04-27
PGEN,"Precigen, Inc. Common Stock",NASDAQ,35202010,Pharmaceuticals,1157006208.0,18268369.54336087,small_cap,True,True,EDGAR,2026-04-27
MRVI,"Maravai LifeSciences Holdings, Inc. Class A Common Stock",NASDAQ,35202010,Pharmaceuticals,1121641472.0,6460207.5381747885,small_cap,False,True,EDGAR,2026-04-27
SEPN,"Septerna, Inc. Common Stock",NASDAQ,35202010,Pharmaceuticals,1082692736.0,7742755.452035268,small_cap,False,True,EDGAR,2026-04-27
ABCL,AbCellera Biologics Inc. Common Shares,NASDAQ,35202010,Pharmaceuticals,1067124864.0,11981697.93393294,small_cap,False,True,EDGAR,2026-04-27
SVRA,Savara Inc. Common Stock,NASDAQ,35202010,Pharmaceuticals,1025477888.0,9412284.254959425,small_cap,True,True,EDGAR,2026-04-27
AVBP,"ArriVent BioPharma, Inc. Common Stock",NASDAQ,35202010,Pharmaceuticals,1008239040.0,12499815.24278005,small_cap,True,True,EDGAR,2026-04-27
INBX,"Inhibrx Biosciences, Inc. Common Stock",NASDAQ,35201010,Biotechnology,999009408.0,33930869.68282064,small_cap,True,True,EDGAR,2026-04-27
GERN,Geron Corporation Common Stock,NASDAQ,35202010,Pharmaceuticals,992844160.0,30924116.76100135,small_cap,True,True,EDGAR,2026-04-27
CMPX,"Compass Therapeutics, Inc. Common Stock",NASDAQ,35201010,Biotechnology,958067776.0,14480105.779585838,small_cap,True,False,EDGAR,2026-04-27
GHRS,GH Research PLC Ordinary Shares,NASDAQ,35202010,Pharmaceuticals,931681536.0,3891002.9741128287,small_cap,False,True,EDGAR,2026-04-27
FTRE,Fortrea Holdings Inc. Common Stock,NASDAQ,35201010,Biotechnology,929389952.0,10685817.542384466,small_cap,False,True,ETF,2026-04-27
QURE,uniQure N.V. Ordinary Shares,NASDAQ,35202010,Pharmaceuticals,921058176.0,27849698.153003056,small_cap,True,True,EDGAR,2026-04-27
URGN,UroGen Pharma Ltd. Ordinary Shares,NASDAQ,35202010,Pharmaceuticals,899648512.0,16298882.95777003,small_cap,False,True,EDGAR,2026-04-27
OPK,"OPKO Health, Inc. Common Stock",NASDAQ,35202010,Pharmaceuticals,898210496.0,2806923.3364355564,small_cap,False,True,EDGAR,2026-04-27
CDNA,"CareDx, Inc. Common Stock",NASDAQ,35203010,Life Science Tools & Services,893899264.0,13166537.155539194,small_cap,True,True,ETF,2026-04-27
SLS,"SELLAS Life Sciences Group, Inc. Common Stock",NASDAQ,35202010,Pharmaceuticals,888706752.0,31048569.129808743,small_cap,True,False,EDGAR,2026-04-27
PHAT,"Phathom Pharmaceuticals, Inc. Common Stock",NASDAQ,35202010,Pharmaceuticals,863633856.0,13013364.772672653,small_cap,False,True,EDGAR,2026-04-27
XNCR,"Xencor, Inc. Common Stock",NASDAQ,35202010,Pharmaceuticals,849994880.0,10385289.716288248,small_cap,True,True,EDGAR,2026-04-27
JANX,"Janux Therapeutics, Inc. Common Stock",NASDAQ,35202010,Pharmaceuticals,843126720.0,17012053.974288303,small_cap,True,True,EDGAR,2026-04-27
SANA,"Sana Biotechnology, Inc. Common Stock",NASDAQ,35201010,Biotechnology,835293440.0,11589792.240490913,small_cap,True,True,EDGAR,2026-04-27
SPRY,"ARS Pharmaceuticals, Inc. Common Stock",NASDAQ,35202010,Pharmaceuticals,820443456.0,13486403.546474775,small_cap,True,True,EDGAR,2026-04-27
ABUS,Arbutus Biopharma Corporation Common Stock,NASDAQ,35202010,Pharmaceuticals,817377088.0,9358095.689608255,small_cap,True,True,EDGAR,2026-04-27
BIOA,"BioAge Labs, Inc. Common Stock",NASDAQ,35202010,Pharmaceuticals,808327872.0,9525329.598719278,small_cap,False,True,EDGAR,2026-04-27
ANNX,"Annexon, Inc. Common Stock",NASDAQ,35202010,Pharmaceuticals,807882816.0,15150868.64786466,small_cap,True,True,EDGAR,2026-04-27
MNKD,MannKind Corporation Common Stock,NASDAQ,35202010,Pharmaceuticals,804142144.0,12697918.066695532,small_cap,True,True,EDGAR,2026-04-27
CGEM,"Cullinan Therapeutics, Inc. Common Stock",NASDAQ,35201010,Biotechnology,794708096.0,11015018.22016716,small_cap,True,True,EDGAR,2026-04-27
KALV,"KalVista Pharmaceuticals, Inc. Common Stock",NASDAQ,35202010,Pharmaceuticals,782962048.0,22137832.0896403,small_cap,True,True,EDGAR,2026-04-27
CSTL,"Castle Biosciences, Inc. Common Stock",NASDAQ,35203010,Life Science Tools & Services,761564608.0,7306446.673145294,small_cap,False,True,ETF,2026-04-27
OCGN,"Ocugen, Inc. Common Stock",NASDAQ,35201010,Biotechnology,750884736.0,17869479.45627292,small_cap,True,False,EDGAR,2026-04-27
CTMX,"CytomX Therapeutics, Inc. Common Stock",NASDAQ,35202010,Pharmaceuticals,745515712.0,58354183.441999756,small_cap,True,True,EDGAR,2026-04-27
PURR,Hyperliquid Strategies Inc Common Stock,NASDAQ,,,743805056.0,31726358.310551643,small_cap,True,False,ETF,2026-04-27
